{
  "$schema": "http://json-schema.org/draft-07/schema#",
  "$id": "https://basecamp.com/schemas/event-feed-digest.json",
  "title": "Event-feed srv2 digest and checkpoint flat-key vectors",
  "type": "object",
  "additionalProperties": false,
  "required": [
    "description",
    "scheme",
    "srv2_vectors",
    "flat_key_cases"
  ],
  "properties": {
    "description": {
      "type": "string",
      "minLength": 1
    },
    "scheme": {
      "const": "srv2",
      "description": "The digest scheme version these vectors pin. A server-side change to the canonicalization or algorithm ships as srv3 with new vectors; the SDK checkpoint-lineage namespace (`<scheme>-<digest>`) moves with it."
    },
    "srv2_vectors": {
      "type": "array",
      "minItems": 11,
      "items": {
        "type": "object",
        "additionalProperties": false,
        "required": [
          "name",
          "filters",
          "canonical_json",
          "digest"
        ],
        "properties": {
          "name": {
            "type": "string",
            "minLength": 1
          },
          "filters": {
            "type": "object",
            "additionalProperties": false,
            "properties": {
              "types": {
                "type": "array",
                "items": {
                  "type": "string"
                }
              },
              "buckets": {
                "type": "array",
                "items": {
                  "type": [
                    "integer",
                    "string"
                  ]
                }
              },
              "creators": {
                "type": "array",
                "items": {
                  "type": [
                    "integer",
                    "string"
                  ]
                }
              },
              "performers": {
                "type": "array",
                "items": {
                  "type": [
                    "integer",
                    "string"
                  ]
                }
              },
              "exclude_performers": {
                "type": "array",
                "items": {
                  "type": [
                    "integer",
                    "string"
                  ]
                }
              },
              "actor_types": {
                "type": "array",
                "items": {
                  "enum": [
                    "agent",
                    "person"
                  ]
                }
              },
              "reasons": {
                "type": "array",
                "items": {
                  "enum": [
                    "mentioned",
                    "assigned",
                    "subscribed",
                    "watched",
                    "pinged",
                    "boosted"
                  ]
                }
              }
            }
          },
          "canonical_json": {
            "type": "string",
            "pattern": "^\\{.*\\}$"
          },
          "digest": {
            "type": "string",
            "pattern": "^[0-9a-f]{16}$"
          }
        }
      }
    },
    "flat_key_cases": {
      "type": "array",
      "minItems": 3,
      "items": {
        "type": "object",
        "additionalProperties": false,
        "required": [
          "name",
          "origin",
          "account_id",
          "consumer_namespace",
          "filters",
          "filter_key",
          "flat_key"
        ],
        "properties": {
          "name": {
            "type": "string",
            "minLength": 1
          },
          "origin": {
            "type": "string",
            "minLength": 1
          },
          "account_id": {
            "type": "string",
            "minLength": 1
          },
          "consumer_namespace": {
            "type": "string",
            "minLength": 1
          },
          "filters": {
            "$ref": "#/properties/srv2_vectors/items/properties/filters"
          },
          "filter_key": {
            "type": "string",
            "pattern": "^srv2-[0-9a-f]{16}$"
          },
          "flat_key": {
            "type": "string",
            "pattern": "^\\["
          }
        }
      }
    }
  }
}
